{
  "generation_report_schema": "helix.fixture-generation-report/1",
  "registry": {
    "path": "fixtures/generation/registry-v1.json",
    "bytes": 4392,
    "sha256": "b807baef1b682f83b2af968d34d9ea8f6b59e3f2d18a90b30b6e8558a9bf5146"
  },
  "generators": [
    {
      "id": "toolchain.splitmix64-vectors",
      "version": "1.0.0",
      "randomness": "seeded",
      "seed": "0x48454c4958444231",
      "algorithm": "helix.splitmix64-fixed-gamma/1",
      "artifacts": [
        {
          "path": "fixtures/generation/vectors/splitmix64-v1.json",
          "format": "json",
          "schema_path": "fixtures/generation/schema/prng-vector-v1.schema.json",
          "bytes": 595,
          "sha256": "15f0859962651223d64eb641e2c919022ad7a18d9afcf94280b1dab2920946cd"
        }
      ]
    },
    {
      "id": "semantics.corpus-v1",
      "version": "1.0.0",
      "randomness": "none",
      "seed": null,
      "algorithm": null,
      "artifacts": [
        {
          "path": "fixtures/semantic/manifest.json",
          "format": "json",
          "schema_path": "fixtures/semantic/schema/semantic-corpus-manifest-v1.schema.json",
          "bytes": 10974,
          "sha256": "06f80fb774894eaab6de354dea0124a9ce5619b55a81515ece6338f459e0957d"
        }
      ]
    },
    {
      "id": "semantics.oracle-report-v1",
      "version": "1.0.0",
      "randomness": "none",
      "seed": null,
      "algorithm": null,
      "artifacts": [
        {
          "path": "fixtures/semantic/oracle-report-v1.json",
          "format": "json",
          "schema_path": "fixtures/semantic/schema/semantic-oracle-report-v1.schema.json",
          "bytes": 4863,
          "sha256": "34a7b3a49998539a5f8d1b117dafa9bcca7988f6302a2cf56b9af07057c08d11"
        }
      ]
    },
    {
      "id": "compatibility.matrix-v1",
      "version": "1.0.0",
      "randomness": "none",
      "seed": null,
      "algorithm": null,
      "artifacts": [
        {
          "path": "compatibility/v1/matrix-v1.json",
          "format": "json",
          "schema_path": "compatibility/v1/schema/matrix-v1.schema.json",
          "bytes": 218324,
          "sha256": "9317179b9a2c78743ff31bb68209621493f0a769f73b4013a707e8244e962db5"
        },
        {
          "path": "docs/compatibility/v1-semantic-compatibility-matrix.md",
          "format": "markdown",
          "schema_path": null,
          "bytes": 103739,
          "sha256": "1d8088367a99d957ad43d72325c5d8bbd50c76b82a77fa7bfe04aeaf3861235f"
        }
      ]
    },
    {
      "id": "hdoc.golden-v1",
      "version": "1.0.0",
      "randomness": "none",
      "seed": null,
      "algorithm": null,
      "artifacts": [
        {
          "path": "fixtures/hdoc/v1/manifest.json",
          "format": "json",
          "schema_path": "fixtures/hdoc/v1/schema/manifest-v1.schema.json",
          "bytes": 9737,
          "sha256": "eaaa1b9fad07661b0592fcf76b590251386c1b8981e6869302543b23ec7877ef"
        }
      ]
    }
  ],
  "verdict": "pass"
}
